Date,Ticker,companyName,Volume,Close,Divid Rate,Divid %,5_Days_pos,above_SMA_50,etf,adr,bond,dividend_type
2024-10-09,BBVA,Banco Bilbao Vizcaya Argentaria S.A. Common Stock,1626700,10.62,0.32,3.05,X,X,,,,CD
2024-10-09,HUYA,"HUYA Inc. American depositary shares, each  representing one Class A ordinary share",4250917,6.02,1.08,17.94,X,X,,,,SC
2024-10-11,EBF,"Ennis, Inc. Common Stock",280000,24.55,2.5,10.18,X,X,,,,CD
2024-10-11,EBF,"Ennis, Inc. Common Stock",280000,24.55,2.5,10.18,X,X,,,,SC
2024-10-11,GNL,"Global Net Lease, Inc. Common Stock",878828,8.37,0.28,3.29,,,,,,CD
2024-10-15,RILYZ,"B. Riley Financial, Inc. 5.25% Senior Notes due 2028",165042,7.23,0.33,4.54,,,,,,CD
