Date,Ticker,companyName,Volume,Close,Divid Rate,Divid %,5_Days_pos,above_SMA_50,etf,adr,bond,dividend_type
2024-12-12,RVT,"Royce Small-Cap Trust, Inc. Common Stock",383335,16.66,0.44,2.64,,X,,,,CD
2024-12-12,RGT,"Royce Global Trust, Inc. Common Stock",24569,12.0,0.47,3.92,X,X,,,,CD
2024-12-12,BWLP,BW LPG Limited Common Shares,763434,11.96,0.42,3.51,X,,,,,CD
2024-12-13,ASBFY,Associated British Foods plc ADR,20734,28.18,0.9,3.2,,,,X,,CD
2024-12-13,NMAI,Nuveen Multi-Asset Income Fund Common Shares of Beneficial Interest,132718,12.84,0.42,3.25,,X,,,,CD
2024-12-13,NREF,"NexPoint Real Estate Finance, Inc. Common Stock",51095,17.43,0.5,2.87,X,X,,,,CD
2024-12-13,INSW,"International Seaways, Inc. Common Stock ",572488,36.13,1.08,2.99,,,,,,CD
2024-12-13,INSW,"International Seaways, Inc. Common Stock ",572488,36.13,1.08,2.99,,,,,,CD
2024-12-13,TPVG,TriplePoint Venture Growth BDC Corp. Common Stock,334422,8.19,0.3,3.66,,X,,,,CD
2024-12-13,CAF,Morgan Stanley China A Share Fund Inc. Common Stock,30133,12.98,0.33,2.52,X,,,,,CD
2024-12-13,EDD,"Morgan Stanley Emerging Markets Domestic Debt Fund, Inc. Common Stock",177405,4.71,0.16,3.4,,,,,,CD
2024-12-13,SFL,SFL Corporation Ltd,853742,10.39,0.27,2.6,,,,,,CD
2024-12-13,PBR,Petroleo Brasileiro S.A.- Petrobras Common Stock,19999598,14.6,0.53,3.66,X,X,,,,SC
2024-12-13,GGT,"Gabelli Multi-Media Trust, Inc. (The) Common Stock",321565,5.09,0.22,4.32,X,X,,,,CD
2024-12-13,IIF,"Morgan Stanley India Investment Fund, Inc. Common Stock",49309,29.47,2.7,9.15,X,X,,,,CD
2024-12-13,MSD,"Morgan Stanley Emerging Markets Debt Fund, Inc. Common Stock",50695,7.97,0.26,3.32,X,X,,,,CD
2024-12-13,GAB,"Gabelli Equity Trust, Inc. (The) Common Stock",986804,5.78,0.15,2.6,,X,,,,CD
2024-12-13,DDS,"Dillard's, Inc. Common Stock",189100,456.53,25.0,5.48,X,X,,,,CD
2024-12-13,TY,Tri Continental Corporation Common Stock,52955,34.19,2.24,6.54,,X,,,,CD
2024-12-13,FUND,"Sprott Focus Trust, Inc. Common Stock",52344,8.12,0.22,2.66,,X,,,,CD
2024-12-13,CSWC,Capital Southwest Corporation Common Stock,434221,22.81,0.63,2.76,,,,,,CD
2024-12-13,CSWC,Capital Southwest Corporation Common Stock,434221,22.81,0.63,2.76,,,,,,CD
2024-12-13,GCV,"Gabelli Convertible and Income Securities Fund, Inc. (The) Common Stock",42792,4.03,0.12,2.98,,X,,,,CD
2024-12-16,STK,Columbia Seligman Premium Technology Growth Fund Inc,44325,35.8,3.27,9.13,X,X,,,,CD
2024-12-16,MRRTY,Marfrig Global Foods S.A ADR,68903,3.48,0.47,13.43,X,X,,X,,SC
2024-12-16,MRRTY,Marfrig Global Foods S.A ADR,68903,3.48,0.49,14.0,X,X,,X,,SC
2024-12-16,EMF,Templeton Emerging Markets Fund Common Stock,31345,12.81,0.51,3.99,X,,,,,CD
2024-12-16,RAND,Rand Capital Corporation Common Stock,10458,21.08,4.2,19.93,X,X,,,,
2024-12-16,OCSL,Oaktree Specialty Lending Corporation Common Stock,702633,16.13,0.55,3.41,,,,,,CD
2024-12-16,MRCC,Monroe Capital Corporation Common Stock,90805,8.47,0.25,2.95,,X,,,,CD
2024-12-16,GECC,Great Elm Capital Corp. Common Stock,15031,10.41,0.35,3.36,X,X,,,,CD
2024-12-16,TEN,Tsakos Energy Navigation Ltd Common Shares,326778,17.92,0.9,5.02,,,,,,CD
2024-12-17,UNTC,Unit Corp. Com (New),9621,33.97,2.0,5.89,X,X,,,,SC
2024-12-17,UNTC,Unit Corp. Com (New),9621,33.97,1.25,3.68,X,X,,,,CD
2024-12-17,UNTC,Unit Corp. Com (New),9621,33.97,1.25,3.68,X,X,,,,SC
2024-12-17,UNTC,Unit Corp. Com (New),9621,33.97,2.0,5.89,X,X,,,,CD
2024-12-17,PPSI,"Pioneer Power Solutions, Inc. Common Stock",193809,5.83,1.5,25.73,,,,,,SC
2024-12-17,MCN,XAI Madison Equity Premium Income Fund Common Shares,58062,7.02,0.18,2.56,,,,,,CD
2024-12-17,NMFC,New Mountain Finance Corporation Common Stock,514393,11.8,0.33,2.8,X,X,,,,CD
2024-12-17,FDUS,Fidus Investment Corporation Common Stock,204322,21.41,0.61,2.85,X,X,,,,CD
2024-12-17,FDUS,Fidus Investment Corporation Common Stock,204322,21.41,0.61,2.85,X,X,,,,CD
2024-12-17,TCPC,BlackRock TCP Capital Corp. Common Stock,505775,9.41,0.44,4.68,X,X,,,,SC
2024-12-17,TCPC,BlackRock TCP Capital Corp. Common Stock,505775,9.41,0.44,4.68,X,X,,,,CD
2024-12-17,NMFC,New Mountain Finance Corporation Common Stock,514393,11.8,0.33,2.8,X,X,,,,CD
2024-12-18,TEF,Telefonica SA Common Stock,832300,4.44,0.16,3.55,,,,,,CD
2024-12-18,SUZ,Suzano S.A. American Depositary Shares (each representing One Ordinary Share),1743897,10.69,0.34,3.15,,X,,,,CD
2024-12-19,JOF,Japan Smaller Capitalization Fund Inc Common Stock,95600,8.0,0.31,3.9,,X,,,,CD
2024-12-19,DNKEY,Danske Bank AS ADR,20200,15.36,0.46,3.0,X,X,,X,,SC
2024-12-20,WHF,"WhiteHorse Finance, Inc. Common Stock",69300,10.64,0.38,3.62,X,,,,,CD
2024-12-20,ICMB,"Investcorp Credit Management BDC, Inc. Common Stock",31200,3.22,0.12,3.73,X,X,,,,CD
2024-12-20,OFS,OFS Capital Corporation Common Stock,66400,8.58,0.34,3.96,X,X,,,,CD
2024-12-20,SDXAY,Sodexo ADR,45400,16.78,0.57,3.39,,,,X,,CD
2024-12-23,HNW,"Pioneer Diversified High Income Fund, Inc.",16500,12.43,0.32,2.61,X,X,,,,CD
2024-12-23,PIN,Invesco India ETF,16400,29.22,2.22,7.6,X,X,X,,,CD
